{
  "table": "odds.supplied",
  "schemaVersion": 1,
  "dataVersion": 1,
  "gameVersion": "0.27.1",
  "generatedAt": "2026-10-09T19:59:30Z",
  "license": "CC0-1.0",
  "sources": {
    "pending": {
      "title": "No page supplied yet (D-16 (a)): rows come once you supply them"
    }
  },
  "rows": []
}
